objectid,filename,youtubeid,title,format,description,creator,recipient,date,date-is-approximate?,item_information,subject,location,latitude,longitude,related_publication,publisher-digital,source,findingaid,original-identifier,identifier,rights,rightsstatement,type,language,relation
vms24,LetterPlaceholder.jpg,,Letter from Persephone Collins to Mary Sherwood,image/jpeg,"Letter from Persephone Collins to Mary Sherwood, where she expresses excitement over making a good friend and takes an interest in Mary's taxidermy.",Persephone Collins,,1877-05-01,,letter,Persephone Collins;letters,"Cambridge, England",,,,"Rosebridge College Archives and Special Collections","Mary Sherwood Collection, 1871-1905, Rosebridge College Archives and Special Collections",,,,"These materials are fully within public domain",,StillImage,eng,
vms26,Letter2Placeholder.jpg,,Letter from Persephone Collins to Mary Sherwood,image/jpeg,"A letter from Persephone Collins to Mary Sherwood expressing excitement at coming to live with Mary while her husband Elias is away on a trip with a friend, and excitement at seeing her newest taxidermy project.",Persephone Collins,,1885-05-26,,letter,Persephone Collins;letters,"Cambridge, England",,,,"Rosebridge College Archives and Special Collections","Mary Sherwood Collection, 1871-1905, Rosebridge College Archives and Special Collections",,,,"These materials are fully within public domain",,StillImage,eng,
vms6,SquirrelsPlaceholder.jpg,,Squirrel Girls With Flowers,image/jpeg,"A Taxidermy Diorama of two Red Squirrels in dresses handing each other Violet flowers.",Mary Sherwood,,1882,yes,taxidermy,red squirrel; violet flower; taxidermy,"Cambridge, England",,,,"Rosebridge College Archives and Special Collections","Mary Sherwood Collection, 1871-1905, Rosebridge College Archives and Special Collections",,,,"These materials are fully within public domain",,StillImage,eng,
vms8,HaresPlaceholder.jpg,,Hares Dancing,image/jpeg,"A Taxidermy Diorama of two European Hares dancing in a lively jig.",Mary Sherwood,,1885,yes,taxidermy,european hare; dance; taxidermy,"Cambridge, England",,,,"Rosebridge College Archives and Special Collections","Mary Sherwood Collection, 1871-1905, Rosebridge College Archives and Special Collections",,,,"These materials are fully within public domain",,StillImage,eng,
vms16,BirdTreePlaceholder.jpg,,Bird Family,image/jpeg,"A Taxidermy Diorama of a number of different birds in various forms of dress, each representing members of Mary Sherwood's Family. The Egyptian Vulture is Mary herself, and the dove resting on its back is Persephone.",Mary Sherwood,,1901,yes,taxidermy,family tree; dove; egyptian vulture; taxidermy,"Cambridge, England",,,,"Rosebridge College Archives and Special Collections","Mary Sherwood Collection, 1871-1905, Rosebridge College Archives and Special Collections",,,,"These materials are fully within public domain",,StillImage,eng,
